include ./test_data.slt

query IT rowsort
select * from inventory
----
1	'health1'
2	'health2'
3	'health3'

statement ok
DELETE FROM inventory WHERE inventory_id = 1

query IT rowsort
select * from inventory
----
2	'health2'
3	'health3'

statement ok
DELETE FROM inventory

query IT
select * from inventory
----
